{
  "$schema": "https://json-schema.org/draft/2020-12/schema",
  "$id": "https://aibox.projectious.work/contracts/v1alpha1/release-gate-evidence.schema.json",
  "title": "ReleaseGateEvidence v1alpha1",
  "type": "object",
  "additionalProperties": false,
  "required": ["apiVersion", "kind", "gate", "status", "candidateCommit", "binarySha256", "command", "startedAt", "completedAt", "scenarios", "artifacts"],
  "properties": {
    "apiVersion": { "const": "aibox.projectious.work/release-evidence/v1alpha1" },
    "kind": { "const": "ReleaseGateEvidence" },
    "gate": { "type": "string", "minLength": 1 },
    "status": { "const": "passed" },
    "candidateCommit": { "type": "string", "pattern": "^[0-9a-fA-F]{40}$" },
    "binarySha256": { "type": "string", "pattern": "^sha256:[0-9a-fA-F]{64}$" },
    "command": { "type": "string", "minLength": 1 },
    "startedAt": { "type": "string", "format": "date-time" },
    "completedAt": { "type": "string", "format": "date-time" },
    "scenarios": { "type": "array", "minItems": 1, "uniqueItems": true, "items": { "type": "string", "minLength": 1 } },
    "artifacts": { "type": "array", "minItems": 1, "items": { "$ref": "#/$defs/artifact" } }
  },
  "$defs": {
    "artifact": {
      "type": "object",
      "additionalProperties": false,
      "required": ["path", "sha256"],
      "properties": {
        "path": { "type": "string", "pattern": "^(?!/)(?!.*(?:^|/)\\.\\.(?:/|$)).+$" },
        "sha256": { "type": "string", "pattern": "^sha256:[0-9a-fA-F]{64}$" }
      }
    }
  }
}
